{
  "schema_version": "2.2",
  "verdict": "SHIP WITH FIXES",
  "confidence": "medium",
  "inputs_ledger": [
    {
      "item": "request.md",
      "status": "seen",
      "matters": true
    },
    {
      "item": "config/limits.yaml",
      "status": "not_seen",
      "matters": true
    }
  ],
  "coverage": {
    "checked": [
      {
        "unit": "app.py",
        "kind": "file"
      },
      {
        "unit": "app.py:handle",
        "kind": "function"
      }
    ],
    "not_checked": [
      {
        "unit": "config/limits.yaml",
        "reason": "not supplied"
      }
    ]
  },
  "findings": [],
  "refuted": []
}
