{
  "schema_version": "2.2",
  "verdict": "SHIP WITH FIXES",
  "confidence": "medium",
  "inputs_ledger": [
    {
      "item": "request.md",
      "status": "seen",
      "matters": true
    },
    {
      "item": "config/limits.yaml",
      "status": "not_seen",
      "matters": true
    }
  ],
  "coverage": {
    "checked": [
      {
        "unit": "app.py",
        "kind": "file"
      },
      {
        "unit": "app.py:handle",
        "kind": "function"
      }
    ],
    "not_checked": [
      {
        "unit": "config/limits.yaml",
        "reason": "not supplied"
      }
    ]
  },
  "findings": [
    {
      "id": "S1",
      "status": "needs_validation",
      "track": "B",
      "location": "audit.py:12",
      "suspicion": "audit.record() may drop events that are queued when the process exits.",
      "unresolved_fact": "Whether company_audit.record() flushes synchronously or on a background thread (the library was not supplied)."
    }
  ],
  "refuted": [
    {
      "id": "C2",
      "candidate": "The script has no error handling.",
      "evidence": "Line 2 is set -euo pipefail, which stops the script on any failing command."
    }
  ]
}
