{
  "schema_version": "2.2",
  "verdict": "REWORK",
  "confidence": "medium",
  "inputs_ledger": [
    {
      "item": "request.md",
      "status": "seen",
      "matters": true
    },
    {
      "item": "config/limits.yaml",
      "status": "not_seen",
      "matters": true
    }
  ],
  "coverage": {
    "checked": [
      {
        "unit": "app.py",
        "kind": "file"
      },
      {
        "unit": "app.py:handle",
        "kind": "function"
      }
    ],
    "not_checked": [
      {
        "unit": "config/limits.yaml",
        "reason": "not supplied"
      }
    ]
  },
  "findings": [
    {
      "id": "F1",
      "status": "confirmed",
      "severity": "High",
      "evidence_level": "CONFIRMED",
      "track": "C",
      "location": "note.md:12",
      "scenario": "The note quotes the rule as 'must' where the source says 'may', so the committee reads a duty that does not exist.",
      "fix": "Quote the source exactly.",
      "answers": {
        "a": true,
        "b": true,
        "c": false,
        "d": true
      }
    }
  ],
  "refuted": [
    {
      "id": "C2",
      "candidate": "The script has no error handling.",
      "evidence": "Line 2 is set -euo pipefail, which stops the script on any failing command."
    }
  ]
}
