{
  "schema_version": "2.2",
  "verdict": "REWORK",
  "confidence": "medium",
  "inputs_ledger": [
    {
      "item": "request.md",
      "status": "seen",
      "matters": true
    },
    {
      "item": "config/limits.yaml",
      "status": "not_seen",
      "matters": true
    }
  ],
  "coverage": {
    "checked": [
      {
        "unit": "app.py",
        "kind": "file"
      },
      {
        "unit": "app.py:handle",
        "kind": "function"
      }
    ],
    "not_checked": [
      {
        "unit": "config/limits.yaml",
        "reason": "not supplied"
      }
    ]
  },
  "findings": [
    {
      "id": "F1",
      "status": "confirmed",
      "severity": "High",
      "evidence_level": "PROBABLE",
      "track": "A",
      "location": "memo.md:8",
      "scenario": "If the volume is ten times the memo's figure, the monthly cost exceeds the VM it replaces and the saving claimed becomes a loss.",
      "fix": "Recompute from the supplied CSV.",
      "answers": {
        "a": true,
        "b": false,
        "c": true,
        "d": true
      }
    }
  ],
  "refuted": [
    {
      "id": "C2",
      "candidate": "The script has no error handling.",
      "evidence": "Line 2 is set -euo pipefail, which stops the script on any failing command."
    }
  ]
}
